{
  "$schema": "https://json-schema.org/draft/2020-12/schema",
  "type": "object",
  "properties": {
    "$schema": {
      "type": "string"
    },
    "format": {
      "type": "string",
      "enum": [
        "breezel-import",
        "appshots-import"
      ]
    },
    "version": {
      "type": "number",
      "const": 1
    },
    "name": {
      "type": "string",
      "minLength": 1,
      "maxLength": 100
    },
    "exportSize": {
      "type": "string",
      "minLength": 1
    },
    "brand": {
      "type": "object",
      "properties": {
        "primary": {
          "type": "string",
          "pattern": "^#(?:[0-9a-fA-F]{3}|[0-9a-fA-F]{6})$"
        },
        "style": {
          "type": "string",
          "enum": [
            "minimal",
            "bold",
            "warm",
            "playful",
            "elegant",
            "editorial"
          ]
        },
        "font": {
          "type": "string",
          "minLength": 1
        },
        "textColor": {
          "type": "string",
          "pattern": "^#(?:[0-9a-fA-F]{3}|[0-9a-fA-F]{6})$"
        },
        "highlightColor": {
          "type": "string",
          "pattern": "^#(?:[0-9a-fA-F]{3}|[0-9a-fA-F]{6})$"
        },
        "headlineSize": {
          "type": "number",
          "minimum": 12,
          "maximum": 200
        },
        "subheadlineSize": {
          "type": "number",
          "minimum": 12,
          "maximum": 200
        },
        "background": {
          "oneOf": [
            {
              "type": "object",
              "properties": {
                "type": {
                  "type": "string",
                  "const": "solid"
                },
                "color": {
                  "type": "string",
                  "pattern": "^#(?:[0-9a-fA-F]{3}|[0-9a-fA-F]{6})$"
                }
              },
              "required": [
                "type",
                "color"
              ],
              "additionalProperties": false
            },
            {
              "type": "object",
              "properties": {
                "type": {
                  "type": "string",
                  "const": "gradient"
                },
                "from": {
                  "type": "string",
                  "pattern": "^#(?:[0-9a-fA-F]{3}|[0-9a-fA-F]{6})$"
                },
                "to": {
                  "type": "string",
                  "pattern": "^#(?:[0-9a-fA-F]{3}|[0-9a-fA-F]{6})$"
                }
              },
              "required": [
                "type",
                "from",
                "to"
              ],
              "additionalProperties": false
            },
            {
              "type": "object",
              "properties": {
                "type": {
                  "type": "string",
                  "const": "preset"
                },
                "id": {
                  "type": "string",
                  "enum": [
                    "sunset",
                    "ocean",
                    "mint",
                    "berry",
                    "royal",
                    "rose"
                  ]
                }
              },
              "required": [
                "type",
                "id"
              ],
              "additionalProperties": false
            }
          ]
        }
      },
      "additionalProperties": false
    },
    "device": {
      "type": "object",
      "properties": {
        "id": {
          "type": "string",
          "minLength": 1
        },
        "color": {
          "type": "string",
          "minLength": 1
        },
        "style": {
          "type": "string",
          "enum": [
            "flat",
            "3d"
          ]
        },
        "shadow": {
          "anyOf": [
            {
              "type": "boolean"
            },
            {
              "type": "object",
              "properties": {
                "enabled": {
                  "type": "boolean"
                },
                "color": {
                  "type": "string",
                  "pattern": "^#(?:[0-9a-fA-F]{3}|[0-9a-fA-F]{6})$"
                },
                "blur": {
                  "type": "number",
                  "minimum": 0,
                  "maximum": 100
                },
                "offsetX": {
                  "type": "number",
                  "minimum": -50,
                  "maximum": 50
                },
                "offsetY": {
                  "type": "number",
                  "minimum": -50,
                  "maximum": 50
                }
              },
              "additionalProperties": false
            }
          ]
        }
      },
      "additionalProperties": false
    },
    "screens": {
      "minItems": 1,
      "type": "array",
      "items": {
        "type": "object",
        "properties": {
          "image": {
            "type": "string",
            "minLength": 1
          },
          "devices": {
            "minItems": 1,
            "type": "array",
            "items": {
              "type": "object",
              "properties": {
                "image": {
                  "type": "string",
                  "minLength": 1
                },
                "id": {
                  "type": "string",
                  "minLength": 1
                },
                "color": {
                  "type": "string",
                  "minLength": 1
                },
                "style": {
                  "type": "string",
                  "enum": [
                    "flat",
                    "3d"
                  ]
                },
                "shadow": {
                  "anyOf": [
                    {
                      "type": "boolean"
                    },
                    {
                      "type": "object",
                      "properties": {
                        "enabled": {
                          "type": "boolean"
                        },
                        "color": {
                          "type": "string",
                          "pattern": "^#(?:[0-9a-fA-F]{3}|[0-9a-fA-F]{6})$"
                        },
                        "blur": {
                          "type": "number",
                          "minimum": 0,
                          "maximum": 100
                        },
                        "offsetX": {
                          "type": "number",
                          "minimum": -50,
                          "maximum": 50
                        },
                        "offsetY": {
                          "type": "number",
                          "minimum": -50,
                          "maximum": 50
                        }
                      },
                      "additionalProperties": false
                    }
                  ]
                },
                "x": {
                  "type": "number",
                  "minimum": -100,
                  "maximum": 200
                },
                "y": {
                  "type": "number",
                  "minimum": -50,
                  "maximum": 150
                },
                "scale": {
                  "type": "number",
                  "minimum": 10,
                  "maximum": 150
                },
                "rotation": {
                  "type": "number",
                  "minimum": -360,
                  "maximum": 360
                },
                "rotateX": {
                  "type": "number",
                  "minimum": -30,
                  "maximum": 30
                },
                "rotateY": {
                  "type": "number",
                  "minimum": -45,
                  "maximum": 45
                }
              },
              "additionalProperties": false
            }
          },
          "headline": {
            "type": "string",
            "minLength": 1
          },
          "subheadline": {
            "type": "string"
          },
          "layout": {
            "type": "string",
            "enum": [
              "centered",
              "bleed-bottom",
              "bleed-top",
              "float-center",
              "tilt-left",
              "tilt-right",
              "perspective",
              "float-bottom"
            ]
          },
          "background": {
            "oneOf": [
              {
                "type": "object",
                "properties": {
                  "type": {
                    "type": "string",
                    "const": "solid"
                  },
                  "color": {
                    "type": "string",
                    "pattern": "^#(?:[0-9a-fA-F]{3}|[0-9a-fA-F]{6})$"
                  }
                },
                "required": [
                  "type",
                  "color"
                ],
                "additionalProperties": false
              },
              {
                "type": "object",
                "properties": {
                  "type": {
                    "type": "string",
                    "const": "gradient"
                  },
                  "from": {
                    "type": "string",
                    "pattern": "^#(?:[0-9a-fA-F]{3}|[0-9a-fA-F]{6})$"
                  },
                  "to": {
                    "type": "string",
                    "pattern": "^#(?:[0-9a-fA-F]{3}|[0-9a-fA-F]{6})$"
                  }
                },
                "required": [
                  "type",
                  "from",
                  "to"
                ],
                "additionalProperties": false
              },
              {
                "type": "object",
                "properties": {
                  "type": {
                    "type": "string",
                    "const": "preset"
                  },
                  "id": {
                    "type": "string",
                    "enum": [
                      "sunset",
                      "ocean",
                      "mint",
                      "berry",
                      "royal",
                      "rose"
                    ]
                  }
                },
                "required": [
                  "type",
                  "id"
                ],
                "additionalProperties": false
              }
            ]
          },
          "text": {
            "type": "object",
            "properties": {
              "color": {
                "type": "string",
                "pattern": "^#(?:[0-9a-fA-F]{3}|[0-9a-fA-F]{6})$"
              },
              "font": {
                "type": "string",
                "minLength": 1
              },
              "headlineSize": {
                "type": "number",
                "minimum": 12,
                "maximum": 200
              },
              "subheadlineSize": {
                "type": "number",
                "minimum": 12,
                "maximum": 200
              },
              "headline": {
                "type": "object",
                "properties": {
                  "x": {
                    "type": "number",
                    "minimum": 0,
                    "maximum": 100
                  },
                  "y": {
                    "type": "number",
                    "minimum": 0,
                    "maximum": 100
                  },
                  "width": {
                    "type": "number",
                    "minimum": 20,
                    "maximum": 120
                  }
                },
                "additionalProperties": false
              },
              "subheadline": {
                "type": "object",
                "properties": {
                  "x": {
                    "type": "number",
                    "minimum": 0,
                    "maximum": 100
                  },
                  "y": {
                    "type": "number",
                    "minimum": 0,
                    "maximum": 100
                  },
                  "width": {
                    "type": "number",
                    "minimum": 20,
                    "maximum": 120
                  }
                },
                "additionalProperties": false
              }
            },
            "additionalProperties": false
          },
          "device": {
            "type": "object",
            "properties": {
              "id": {
                "type": "string",
                "minLength": 1
              },
              "color": {
                "type": "string",
                "minLength": 1
              },
              "style": {
                "type": "string",
                "enum": [
                  "flat",
                  "3d"
                ]
              },
              "shadow": {
                "anyOf": [
                  {
                    "type": "boolean"
                  },
                  {
                    "type": "object",
                    "properties": {
                      "enabled": {
                        "type": "boolean"
                      },
                      "color": {
                        "type": "string",
                        "pattern": "^#(?:[0-9a-fA-F]{3}|[0-9a-fA-F]{6})$"
                      },
                      "blur": {
                        "type": "number",
                        "minimum": 0,
                        "maximum": 100
                      },
                      "offsetX": {
                        "type": "number",
                        "minimum": -50,
                        "maximum": 50
                      },
                      "offsetY": {
                        "type": "number",
                        "minimum": -50,
                        "maximum": 50
                      }
                    },
                    "additionalProperties": false
                  }
                ]
              },
              "x": {
                "type": "number",
                "minimum": -100,
                "maximum": 200
              },
              "y": {
                "type": "number",
                "minimum": -50,
                "maximum": 150
              },
              "scale": {
                "type": "number",
                "minimum": 10,
                "maximum": 150
              },
              "rotation": {
                "type": "number",
                "minimum": -360,
                "maximum": 360
              },
              "rotateX": {
                "type": "number",
                "minimum": -30,
                "maximum": 30
              },
              "rotateY": {
                "type": "number",
                "minimum": -45,
                "maximum": 45
              }
            },
            "additionalProperties": false
          },
          "overlays": {
            "type": "array",
            "items": {
              "type": "object",
              "properties": {
                "image": {
                  "type": "string",
                  "minLength": 1
                },
                "x": {
                  "type": "number",
                  "minimum": -50,
                  "maximum": 150
                },
                "y": {
                  "type": "number",
                  "minimum": -50,
                  "maximum": 150
                },
                "width": {
                  "type": "number",
                  "minimum": 1,
                  "maximum": 100
                },
                "layer": {
                  "type": "string",
                  "enum": [
                    "behind",
                    "front"
                  ]
                },
                "rotation": {
                  "type": "number",
                  "minimum": -360,
                  "maximum": 360
                },
                "shadow": {
                  "anyOf": [
                    {
                      "type": "boolean"
                    },
                    {
                      "type": "object",
                      "properties": {
                        "enabled": {
                          "type": "boolean"
                        },
                        "color": {
                          "type": "string",
                          "pattern": "^#(?:[0-9a-fA-F]{3}|[0-9a-fA-F]{6})$"
                        },
                        "blur": {
                          "type": "number",
                          "minimum": 0,
                          "maximum": 100
                        },
                        "offsetX": {
                          "type": "number",
                          "minimum": -50,
                          "maximum": 50
                        },
                        "offsetY": {
                          "type": "number",
                          "minimum": -50,
                          "maximum": 50
                        }
                      },
                      "additionalProperties": false
                    }
                  ]
                }
              },
              "required": [
                "image"
              ],
              "additionalProperties": false
            }
          }
        },
        "required": [
          "headline"
        ],
        "additionalProperties": false
      }
    }
  },
  "required": [
    "format",
    "version",
    "screens"
  ],
  "additionalProperties": false,
  "title": "Breezel agent import manifest (breezel.json)"
}
