{
  "format": "appshots-import",
  "version": 1,
  "name": "Habitly — App Store",
  "exportSize": "6.9",
  "brand": {
    "primary": "#5B5BD6",
    "style": "bold",
    "highlightColor": "#FFD60A"
  },
  "device": {
    "id": "iphone-17-pro",
    "color": "cosmic-orange",
    "style": "flat",
    "shadow": true
  },
  "screens": [
    {
      "image": "01-today.png",
      "headline": "Build habits <mark>that stick</mark>",
      "subheadline": "Tiny daily wins, tracked for you",
      "layout": "bleed-bottom",
      "overlays": [
        {
          "image": "badge.png",
          "x": 82,
          "y": 30,
          "width": 18,
          "layer": "front"
        }
      ]
    },
    {
      "image": "02-streaks.png",
      "headline": "Watch streaks grow",
      "layout": "tilt-left"
    },
    {
      "image": "03-reminders.png",
      "headline": "Never miss a day",
      "subheadline": "Gentle nudges at the right time",
      "layout": "tilt-right"
    },
    {
      "image": "04-insights.png",
      "headline": "Insights that <mark>motivate</mark>",
      "layout": "perspective"
    },
    {
      "image": "05-focus.png",
      "headline": "Focus on one thing",
      "layout": "centered"
    },
    {
      "image": "06-journal.png",
      "headline": "Reflect in seconds",
      "subheadline": "A private journal for every habit",
      "layout": "bleed-top",
      "background": {
        "type": "solid",
        "color": "#0F172A"
      },
      "text": {
        "color": "#F8FAFC"
      }
    },
    {
      "image": "07-widgets.png",
      "headline": "Widgets everywhere",
      "layout": "float-center"
    },
    {
      "image": "08-share.png",
      "headline": "Share your progress",
      "subheadline": "Invite friends and keep each other on track",
      "layout": "float-bottom"
    },
    {
      "headline": "Light or dark, your call",
      "devices": [
        {
          "image": "09a-light.png",
          "x": 32,
          "y": 40,
          "scale": 55,
          "rotation": -8
        },
        {
          "image": "09b-dark.png",
          "x": 68,
          "y": 44,
          "scale": 55,
          "rotation": 8
        }
      ]
    }
  ]
}
